Moment Promise ID,Parent Flow ID,Moment Promise Statement,Acceptance / Evidence (optional),Notes
MO-0001,FL-0001,"User clicks ""Add Promise"" button",,Add a Product Promise to the project
MO-0002,FL-0001,System displays Promise creation form,,
MO-0003,FL-0001,User enters Promise statement,,
MO-0004,FL-0001,"User clicks ""Save"" button",,
MO-0005,FL-0001,System confirms Promise created and displays in stack,,
MO-0006,FL-0002,User navigates to a specific Promise,,
MO-0007,FL-0002,"User clicks ""Add Epic"" button",,
MO-0008,FL-0002,System displays Epic creation form,,
MO-0009,FL-0002,User enters Epic statement,,
MO-0010,FL-0002,"User clicks ""Save"" button",,
MO-0011,FL-0002,System confirms Epic created and displays under its Promise,,
MO-0012,FL-0003,User navigates to a specific Epic,,
MO-0013,FL-0003,"User clicks ""Add Journey"" button",,
MO-0014,FL-0003,System displays Journey creation form,,
MO-0015,FL-0003,User enters Journey statement,,
MO-0016,FL-0003,"User clicks ""Save"" button",,
MO-0017,FL-0003,System confirms Journey created and displays under its Epic,,
MO-0018,FL-0004,User navigates to a specific Journey,,
MO-0019,FL-0004,"User clicks ""Add Flow"" button",,
MO-0020,FL-0004,System displays Flow creation form,,
MO-0021,FL-0004,User enters Flow statement,,
MO-0022,FL-0004,"User clicks ""Save"" button",,
MO-0023,FL-0004,System confirms Flow created and displays under its Journey,,
MO-0024,FL-0005,User navigates to a specific Flow,,
MO-0025,FL-0005,"User clicks ""Add Moment"" button",,
MO-0026,FL-0005,System displays Moment creation form,,
MO-0027,FL-0005,User selects Moment type,,
MO-0028,FL-0005,User enters Moment statement,,
MO-0029,FL-0005,"User clicks ""Save"" button",,
MO-0030,FL-0005,System confirms Moment created and displays under its Flow,,
MO-0031,FL-0006,"User clicks ""Share"" button",,
MO-0032,FL-0006,System displays Share form,,
MO-0033,FL-0006,User enters teammate's email address,,
MO-0034,FL-0006,User selects permission level,,
MO-0035,FL-0006,"User clicks ""Send Invitation"" button",,
MO-0036,FL-0006,System sends invitation email,,
MO-0037,FL-0006,System logs the invitation in project activity,,
MO-0038,FL-0006,Teammate accepts invitation,,
MO-0039,FL-0007,"Team member clicks ""Add Promise"" button",,
MO-0040,FL-0007,System displays Promise creation form,,
MO-0041,FL-0007,Team member enters initial Promise statement,,
MO-0042,FL-0007,"Team member clicks ""Save"" button",,
MO-0043,FL-0007,System displays the new promise in the stack,,
MO-0044,FL-0007,Another team member opens the promise for editing,,
MO-0045,FL-0007,System displays the promise with edit controls,,
MO-0046,FL-0007,Team member updates the promise statement,,
MO-0047,FL-0007,"Team member clicks ""Save"" to commit changes",,
MO-0048,FL-0007,System confirms the promise was updated,,
MO-0049,FL-0008,Team member opens a specific promise,,
MO-0050,FL-0008,System displays promise with reaction options,,
MO-0051,FL-0008,"Team member votes whether they approve of the promise by selecting an emote (e.g., thumbs up or thumbs down)",,
MO-0052,FL-0008,Team members add comments describing either their approval or disapproval,,
MO-0053,FL-0008,Team lead leaves or updates the promise based on the feedback and reactions,,
MO-0054,FL-0009,User opens a project from the project navigation page,,
MO-0055,FL-0009,System displays the view Sprints page by default,,
MO-0056,FL-0009,User scans the sprint list and notices a specific Moment,,
MO-0057,FL-0009,User clicks on the Moment to open its detail view,,
MO-0058,FL-0009,System displays the Moment detail page,,
MO-0059,FL-0009,User clicks the parent Flow ID link,,
MO-0060,FL-0009,System navigates to the Flow detail page,,
MO-0061,FL-0009,User clicks the parent Journey ID link from the Flow page,,
MO-0062,FL-0009, System navigates to the Journey detail page,,
MO-0063,FL-0009,User clicks the parent Epic ID link from the Journey page,,
MO-0064,FL-0009,System navigates to the Epic detail page,,
MO-0065,FL-0009,User clicks the parent Epic ID link from the Journey page,,
MO-0066,FL-0009,System navigates to the Epic detail page,,
MO-0067,FL-0009,User clicks the parent Promise ID link from the Epic page,,
MO-0068,FL-0009,System navigates to the Product Promise detail page,,
MO-0069,FL-0009,"User clicks a ""Back to Sprint"" button",,
MO-0070,FL-0009,System returns to the view Sprints page,,
MO-0071,FL-0009,User navigates to an item they want to edit,,
MO-0072,FL-0010,User clicks the pencil icon,,
MO-0073,FL-0010,System displays the item in edit mode,,
MO-0074,FL-0010,User modifies the item statement,,
MO-0075,FL-0010,User optionally updates other editable fields,,
MO-0076,FL-0010,"User clicks ""Save"" button",,
MO-0077,FL-0010,System validates the input,,
MO-0078,FL-0010,System saves the changes,,
MO-0079,FL-0010,System displays a success confirmation,,
MO-0080,FL-0011,User navigates to a specific stack item,,
MO-0081,FL-0011,User scrolls to the comments section,,
MO-0082,FL-0011,User clicks into the comment input field,,
MO-0083,FL-0011,User types their comment,,
MO-0084,FL-0011,User optionally mentions a teammate using @,,
MO-0085,FL-0011,System displays mention suggestions as the user types,,
MO-0086,FL-0011,User selects a teammate from the suggestions,,
MO-0087,FL-0011,"User clicks ""Post"" button",,
MO-0088,FL-0011,System displays the new comment in the thread,,
MO-0089,FL-0011,System sends notifications to mentioned users,,
MO-0090,FL-0011,Other team members can view and reply to the comment,,
MO-0091,FL-0012,"User encounters an unfamiliar term (i.e., Promise, Epic, Journey, Flow, Moment) in the interface",,
MO-0092,FL-0012,User hovers their cursor over the term,,
MO-0093,FL-0012,System displays a short tooltip definition,,
MO-0094,FL-0012,User reads the tooltip and understands the basic meaning,,
MO-0095,FL-0013,"User clicks the ""Help"" option in the main navigation bar",,
MO-0096,FL-0013,System displays the help center landing page,,
MO-0097,FL-0013,"User navigates to the ""Understanding the Stack"" page",,
MO-0098,FL-0013,User scrolls to the item definition of the unfamiliar term,,
MO-0099,FL-0013,User navigates back to their project,,
MO-0100,FL-0014,"User clicks the ""Help"" option in the main navigation bar",,
MO-0101,FL-0014,System displays the help center landing page,,
MO-0102,FL-0014,"User navigates to the ""Understanding the Stack"" page",,
MO-0103,FL-0014,User scrolls to the examples section for the term,,
MO-0104,FL-0014,User navigates back to their project,,
MO-0105,FL-0015,"User clicks a ""View Diagram"" link from the project navigation",,
MO-0106,FL-0015,System displays a diagram of the full promise stack,,
MO-0107,FL-0015,User zooms in or out to see more or less detail,,
MO-0108,FL-0015,User closes the diagram and returns to their previous view,,
MO-0109,FL-0016,User navigates to any stack item (except promise),,
MO-0110,FL-0016,User looks at the item's detail page,,
MO-0111,FL-0016,"User clicks ""View Parents"" link",,
MO-0112,FL-0016,System displays alert showing item lineage,,
MO-0113,FL-0016,User reads the parent chain,,
MO-0114,FL-0016,User closes the alert,,
MO-0115,FL-0017,User navigates to a promise,,
MO-0116,FL-0017,User looks at the promise's detail page,,
MO-0117,FL-0017,"User clicks ""View Children"" link",,
MO-0118,FL-0017,System displays alert showing children in an ASCII tree diagram,,
MO-0119,FL-0017,User reads the diagram,,
MO-0120,FL-0017,User closes the alert,,
MO-0121,FL-0018,User creates a new account or logs in for the first time,,
MO-0122,FL-0018,"System displays a welcome modal with a ""Start Tour"" button",,
MO-0123,FL-0018,"User clicks ""Start Tour""",,
MO-0124,FL-0018,System highlights key interface elements one by one with explanatory text,,
MO-0125,FL-0018,"User clicks ""Next"" to advance through each step",,
MO-0126,FL-0018,System progresses to the next highlighted element,,
MO-0127,FL-0018,"User clicks ""Finish"" on the final step",,
MO-0128,FL-0018,System closes the tour and returns the user to their dashboard,,
MO-0129,FL-0019,User hovers over a navigation item,,
MO-0130,FL-0019,System displays a short descriptive tooltip,,
MO-0131,FL-0019,User reads the tooltip,,
MO-0132,FL-0019,User moves their cursor away,,
MO-0133,FL-0020,"User clicks the ""Help"" option in the main navigation bar",,
MO-0134,FL-0020,"User click the ""Site Navigation"" option",,
MO-0135,FL-0020,User clicks play on video,,
MO-0136,FL-0020,System plays the video,,
MO-0137,FL-0020,User watches the video,,
MO-0138,FL-0021,"User clicks ""File"" main navigation menu then ""Import Project""",,
MO-0139,FL-0021,System displays a file picker dialog,,
MO-0140,FL-0021,User selects a project JSON file from their computer,,
MO-0141,FL-0021,User selects a JSON file from their computer,,
MO-0142,FL-0021,"User clicks ""Open""",,
MO-0143,FL-0021,System displays project with data from the file,,
MO-0144,FL-0022,"User clicks ""File"" menu then ""Download Project""",,
MO-0145,FL-0022,System generates a JSON file containing the full project stack,,
MO-0146,FL-0022,System downloads the JSON file,,
MO-0147,FL-0023,"User clicks ""Preview Import"" button",,
MO-0148,FL-0023,System displays a file picker dialog,,
MO-0149,FL-0023,User selects a project JSON file from their computer,,
MO-0150,FL-0023,System displays a diagram of the full promise stack,,
MO-0151,FL-0023,User zooms in or out to see more or less detail,,
MO-0152,FL-0023,User closes the diagram and returns to their previous view,,
MO-0153,FL-0024,"Professor clicks ""Create New Project"" button",,
MO-0154,FL-0024,System displays project creation form,,
MO-0155,FL-0024,Professor enters project name and optional description,,
MO-0156,FL-0024,"Professor clicks ""Create"" button",,
MO-0157,FL-0024,System creates the project and navigates to it,,
MO-0158,FL-0025,Professor opens an existing project,,
MO-0159,FL-0025,Professor navigates to a stack item,,
MO-0160,FL-0025,System displays stack item details,,
MO-0161,FL-0025,Professor clicks set status button,,
MO-0162,FL-0025,"System prompts Professor with status options (i.e., draft, complete)",,
MO-0163,FL-0025,Professor selects status and exits prompt,,
MO-0164,FL-0025,System updates the stack items status,,
MO-0165,FL-0026,Professor opens the project they want to export,,
MO-0166,FL-0026,"Professor clicks ""File"" menu then ""Export Project""",,
MO-0167,FL-0026,System generates a JSON file containing the full project stack,,
MO-0168,FL-0026,System downloads the JSON file,,
MO-0169,FL-0027,"User clicks ""File"" menu then ""Import Requirements""",,
MO-0170,FL-0027,System displays a file picker dialog,,
MO-0171,FL-0027,User selects a PDF from their computer,,
MO-0172,FL-0027,"User clicks ""Open"" or ""Import""",,
MO-0173,FL-0027,System stores file,,
MO-0174,FL-0028,"User clicks the ""Documentation"" option in the main navigation menu",,
MO-0175,FL-0028,User scrolls to document,,
MO-0176,FL-0028,User clicks document,,
MO-0177,FL-0028,System displays document,,
MO-0178,FL-0028,User enter a comment in the text area bellow the document,,
MO-0179,FL-0028,"User clicks the ""Post"" button",,
MO-0180,FL-0028,System saves and displays the comment,,
MO-0181,FL-0029,"User clicks ""Documents"" or ""Files"" in the main navigation",,
MO-0182,FL-0029,System displays a list of all documents across projects,,
MO-0183,FL-0029,User clicks into a search bar at the top of the document list,,
MO-0184,FL-0029,User types a keyword or phrase,,
MO-0185,FL-0029,System filters the document list to show only matches that contain the same text,,
MO-0186,FL-0029,User clicks on a document to open and view it,,
MO-0187,FL-0029,The system displays the document,,
MO-0188,FL-0030,"User clicks a ""Set Sprint Duration"" link from the project navigation",,
MO-0189,FL-0030,"System displays a prompt asking for months, days, weeks.",,
MO-0190,FL-0030,User enters their desired sprint length,,
MO-0191,FL-0030,User clicks confirm,,
MO-0192,FL-0030,System updates the sprint durations,,
MO-0193,FL-0031,User opens the sprint planning view,,
MO-0194,FL-0031,User opens a moment from the backlog,,
MO-0195,FL-0031,User edits the sprint assignment,,
MO-0196,FL-0031,"User click ""Save""",,
MO-0197,FL-0031,System add the moment to the assigned sprint,,
MO-0198,FL-0032,User opens the sprint planning view,,
MO-0199,FL-0032,"User clicks ""Add Moment"" button in the sprint",,
MO-0200,FL-0032,System displays Moment creation form,,
MO-0201,FL-0032,"User enters moment description starting with ""Spike:""",,
MO-0202,FL-0032,"User clicks ""Add to Sprint"" button",,
MO-0203,FL-0032,System adds the moment to the sprint,,
MO-0204,FL-0033,User opens the view Sprints page,,
MO-0205,FL-0033,User opens a moment that needs to be moved,,
MO-0206,FL-0033,System displays the moment with edit controls,,
MO-0207,FL-0033,User updates the sprint assignment,,
MO-0208,FL-0033,"User clicks the ""Save"" button",,
MO-0209,FL-0033,The system updates the moment's assigned Sprint,,
MO-0210,FL-0034,User opens the view Sprints page,,
MO-0211,FL-0034,User opens a moment that needs to be moved,,
MO-0212,FL-0034,System displays the moment with edit controls,,
MO-0213,FL-0034,User updates the sprint assignment to nothing,,
MO-0214,FL-0034,"User clicks the ""Save"" button",,
MO-0215,FL-0034,The system assigns the moment to the backlog,,
MO-0216,FL-0035,User opens the view Sprints page,,
MO-0217,FL-0035,User opens a moment that needs to be updated,,
MO-0218,FL-0035,System displays the moment with edit controls,,
MO-0219,FL-0035,User updates the moment's status to blocked,,
MO-0220,FL-0035,"User clicks the ""Save"" button",,
MO-0221,FL-0035,The system assigns blocked status to the moment,,
MO-0222,FL-0036,User opens the view Sprints page,,
MO-0223,FL-0036,User opens a moment from a future sprint,,
MO-0224,FL-0036,System displays the moment with edit controls,,
MO-0225,FL-0036,User updates the sprint assignment to the current sprint,,
MO-0226,FL-0036,"User clicks the ""Save"" button",,
MO-0227,FL-0036,The system assigns the moment to the current sprint,,
MO-0228,FL-0037,User opens the view Sprints page,,
MO-0229,FL-0037,User opens a moment from the backlog,,
MO-0230,FL-0037,System displays the moment with edit controls,,
MO-0231,FL-0037,User updates the sprint assignment to the current sprint,,
MO-0232,FL-0037,"User clicks the ""Save"" button",,
MO-0233,FL-0037,The system assigns the moment to the current sprint,,
MO-0234,FL-0038,User opens the view Sprints page,,
MO-0235,FL-0038,"User clicks the ""Assigned to Me"" option",,
MO-0236,FL-0038,System filters the current selection to show only moments assigned to the current user,,
MO-0237,FL-0039,User opens the view Sprints page,,
MO-0238,FL-0039,User opens a moment,,
MO-0239,FL-0039,System displays the moment with edit controls,,
MO-0240,FL-0039,User updates the flow assignment to another flow,,
MO-0241,FL-0039,"User clicks the ""Save"" button",,
MO-0242,FL-0039,The system assigns the moment to the new flow,,
MO-0243,FL-0040,User opens the view Sprints page,,
MO-0244,FL-0040,User opens a moment,,
MO-0245,FL-0040,System displays the moment with edit controls,,
MO-0246,FL-0040,"User updates the moment's title to be prefixed with ""Spike: """,,
MO-0247,FL-0040,"User clicks the ""Save"" button",,
MO-0248,FL-0040,The system updates the moment's title,,
MO-0249,FL-0041,User opens the view Sprints page,,
MO-0250,FL-0041,User opens a moment,,
MO-0251,FL-0041,System displays the moment with edit controls,,
MO-0252,FL-0041,User updates the moments type either from job to story or story to job,,
MO-0253,FL-0041,"User clicks the ""Save"" button",,
MO-0254,FL-0041,The system updates the moment type,,
MO-0255,FL-0042,User opens a moment in any view,,
MO-0256,FL-0042,User clicks the estimate field,,
MO-0257,FL-0042,"System displays t-shirt size options (XS, S, M, L, XL, XXL, XXXL)",,
MO-0258,FL-0042,User selects a size,,
MO-0259,FL-0042,"User clicks the ""Save"" button",,
MO-0260,FL-0042,System saves the moment's points,,
MO-0261,FL-0043,User opens the current sprint view,,
MO-0262,FL-0043,System displays a sprint header with total estimate,,
MO-0263,FL-0043,User sees the sum of all moment estimates in the sprint,,
MO-0264,FL-0043,User adds or removes moments from the sprint,,
MO-0265,FL-0043,System automatically updates the total estimate,,
MO-0266,FL-0044,User navigates to a specific Product Promise,,
MO-0267,FL-0044,System displays the promise detail page,,
MO-0268,FL-0044,"User finds a ""Total Effort"" field on the page",,
MO-0269,FL-0044,System shows the sum of all moment estimates under this promise,,
MO-0270,FL-0044,"User adds, removes, or updates moments anywhere under this promise",,
MO-0271,FL-0044,System automatically updates the total effort,,
MO-0272,FL-0045,User navigates to a specific stack item,,
MO-0273,FL-0045,User scrolls to the comments section,,
MO-0274,FL-0045, User types feedback in the comment input,,
MO-0275,FL-0045,"User clicks ""Post"" button",,
MO-0276,FL-0045,System displays the comment,,
MO-0277,FL-0046,User navigates to a specific Product Promise,,
MO-0278,FL-0046,System displays the promise detail page,,
MO-0279,FL-0046,User clicks on view all moments button,,
MO-0280,FL-0046,System displays an alert with all moments listed,,
MO-0281,FL-0046,User reads the moments,,
MO-0282,FL-0046,User exits the alert,,
MO-0283,FL-0047,"Professor Professor clicks ""Projects"" in the main navigation",,
MO-0284,FL-0047,System displays projects shared with the professor + their own,,
MO-0285,FL-0047,Professor finds the student project they would like to open,,
MO-0286,FL-0047,Professor clicks on the project name,,
MO-0287,FL-0047,System opens that student's project,,
MO-0288,FL-0048,User opens the view Sprints page,,
MO-0289,FL-0048,User finds a moment that needs an owner,,
MO-0290,FL-0048,User opens a moment that needs to be updated,,
MO-0291,FL-0048,System displays the moment with edit controls,,
MO-0292,FL-0048,User updates the moment's owner,,
MO-0293,FL-0048,"User clicks the ""Save"" button",,
MO-0294,FL-0048,The system assigns the new owner to the moment,,
MO-0295,FL-0049, User opens a specific moment,,
MO-0296,FL-0049,"User scrolls to the ""Tasks"" section",,
MO-0297,FL-0049,"User clicks ""Add Task"" button",,
MO-0298,FL-0049,System displays task creation form,,
MO-0299,FL-0049,User enters task description,,
MO-0300,FL-0049,"User clicks the ""Owner"" field",,
MO-0301,FL-0049,System displays a dropdown of team members,,
MO-0302,FL-0049,User selects a team member,,
MO-0303,FL-0049,"User clicks ""Save"" button",,
MO-0304,FL-0049,System creates the task and displays it with owner name,,
MO-0305,FL-0050,User opens the view Sprints page,,
MO-0306,FL-0050,"System displays current moments in each sprint along with each moments assigned owners, and estimated work",,
MO-0307,FL-0050,User reviews who has capacity for more work,,
MO-0308,FL-0050,User opens the moment to assign/reassign,,
MO-0309,FL-0050,System displays the moment with edit controls,,
MO-0310,FL-0050,User updates the moment's owner,,
MO-0311,FL-0050,"User clicks the ""Save"" button",,
MO-0312,FL-0050,The system assigns the new owner to the moment,,
MO-0313,FL-0051,Student navigates to a specific Promise,,
MO-0314,FL-0051,"Student clicks the ""Owner"" field on the promise",,
MO-0315,FL-0051,System displays a dropdown of team members,,
MO-0316,FL-0051,Student selects their own name from the list,,
MO-0317,FL-0051,System saves the owner and displays their name on the promise,,
MO-0318,FL-0052,Student navigates to a specific Promise,,
MO-0319,FL-0052,"Student clicks the ""Owner"" field on the promise",,
MO-0320,FL-0052, System displays a dropdown of team members,,
MO-0321,FL-0052,Student selects their own name from the list,,
MO-0322,FL-0052,System saves the new owner and updates the display,,
MO-0323,FL-0053,Current owner navigates to a specific Promise,,
MO-0324,FL-0053,"Current owner clicks the ""Owner"" field on the promise",,
MO-0325,FL-0053,System displays a dropdown of team members,,
MO-0326,FL-0053,Current owner selects another student from the list,,
MO-0327,FL-0053,System saves the new owner and updates the display,,
MO-0328,FL-0054,User opens a specific moment,,
MO-0329,FL-0054,"User clicks the current owner's name or ""Owner"" field",,
MO-0330,FL-0054,System displays a dropdown of team members,,
MO-0331,FL-0054,User selects a new owner from the list,,
MO-0332,FL-0054,System saves the new owner and updates the display,,
MO-0333,FL-0055,User opens a specific moment,,
MO-0334,FL-0055,User finds the task that needs a new owner,,
MO-0335,FL-0055,User clicks the current owner's name on that task,,
MO-0336,FL-0055,System displays a dropdown of team members,,
MO-0337,FL-0055,User selects a new owner from the list,,
MO-0338,FL-0055,"User clicks the ""Save"" button",,
MO-0339,FL-0055,System saves the assignee and updates the display,,
MO-0340,FL-0056,User navigates to a specific issue,,
MO-0341,FL-0056,"User clicks the ""Assignee"" field on the issue",,
MO-0342,FL-0056,System displays a dropdown of team members,,
MO-0343,FL-0056,User selects a team member from the list,,
MO-0344,FL-0056,"User clicks the ""Save"" button",,
MO-0345,FL-0056,System saves the assignee and updates the display,,
MO-0346,FL-0057,User opens the project's main stack view,,
MO-0347,FL-0057,User finds a promise owned by a specific teammate,,
MO-0348,FL-0057,User clicks on that promise to open it,,
MO-0349,FL-0057,System displays the promise detail page,,
MO-0350,FL-0058,User navigates to a specific promise,,
MO-0351,FL-0058,User scrolls to the comments section,,
MO-0352,FL-0058,User types their suggestion in the comment input,,
MO-0353,FL-0058,User optionally includes @mentions,,
MO-0354,FL-0058,"User clicks ""Post"" button",,
MO-0355,FL-0058,System displays the comment,,
MO-0356,FL-0059,User posts a comment on a promise,,
MO-0357,FL-0059,System identifies the promise owner and creator,,
MO-0358,FL-0059,System creates in-app notifications for both users,,
MO-0359,FL-0059,Both users see notification indicators when they next log in,,
MO-0360,FL-0060,User types a comment in any comment input,,
MO-0361,FL-0060,"User types ""@"" followed by a teammate's name",,
MO-0362,FL-0060,User completes and posts the comment,,
MO-0363,FL-0060,System sends an in-app notification to the mentioned user,,
MO-0364,FL-0061,User navigates to the view Sprints page,,
MO-0365,FL-0061,"User click on the ""!"" (create issue) icon",,
MO-0366,FL-0061,User enters issue title and description,,
MO-0367,FL-0061,User optionally assigns an owner,,
MO-0368,FL-0061,"User clicks ""Create"" button",,
MO-0369,FL-0061,System creates the issue and displays it in the backlog,,
MO-0370,FL-0062,User navigates to the view Sprints page,,
MO-0371,FL-0062,User finds an issue that has been resolved,,
MO-0372,FL-0062,User open the issue,,
MO-0373,FL-0062,The system return issue detail and displays edit controls,,
MO-0374,FL-0062,User updates the issues status to resolved,,
MO-0375,FL-0062,"User presses the ""Save"" button",,
MO-0376,FL-0062,The system updates the issues status to be resolved,,
MO-0377,FL-0063,Professor navigates to a specific stack item,,
MO-0378,FL-0063,Professor hovers over the item's reaction area,,
MO-0379,FL-0063,System displays available emote options,,
MO-0380,FL-0063,Professor clicks an emote,,
MO-0381,FL-0063,System saves and displays the reaction,,
MO-0382,FL-0063,Student sees the reaction when they view the item,,
MO-0383,FL-0064,Professor navigates to a specific stack item,,
MO-0384,FL-0064,Professor scrolls to the comments section,,
MO-0385,FL-0064,Professor types their feedback in the comment input,,
MO-0386,FL-0064,"Professor clicks ""Post"" button",,
MO-0387,FL-0064,System displays the comment with user name,,
MO-0388,FL-0064, Student sees the comment when they view the item,,
MO-0389,FL-0065,Student posts a reply to a professor's comment,,
MO-0390,FL-0065,System creates an in-app notification for the professor,,
MO-0391,FL-0065,Professor sees the notification indicator when they next log in,,
MO-0392,FL-0066,Professor posts a comment on a stack item,,
MO-0393,FL-0066,System creates an in-app notification for the students who created or own the item,,
MO-0394,FL-0066,Students sees a notification badge when they next log in,,
MO-0395,FL-0067,Professor posts a comment on a stack item,,
MO-0396,FL-0067,System checks the student's notification preferences,,
MO-0397,FL-0067,System sends an email to the student with the feedback and a link,,
MO-0398,FL-0067,Student clicks the link to navigate directly to the feedback,,
MO-0399,FL-0068,User receives a notification (in-app or email),,
MO-0400,FL-0068,User clicks on the notification,,
MO-0401,FL-0068,System opens the application,,
MO-0402,FL-0068,System navigates directly to the specific stack item and highlights the comment,,
MO-0403,FL-0068,User reads the feedback and can reply immediately,,
MO-0404,FL-0069,User opens the view Sprints page,,
MO-0405,FL-0069,"System displays a countdown or ""X days remaining"" in the sprint header",,
MO-0406,FL-0069,User sees the time remaining,,
MO-0407,FL-0069,System automatically updates the count each day,,
MO-0408,FL-0070,System checks sprint end dates daily,,
MO-0409,FL-0070,System detects a sprint ending in exactly 3 days,,
MO-0410,FL-0070,System creates in-app notifications for all team members,,
MO-0411,FL-0070,Team members see notification badges when they next log in,,
MO-0412,FL-0071,System checks sprint end dates daily,,
MO-0413,FL-0071,System detects a sprint ending in exactly 3 days,,
MO-0414,FL-0071,System checks each team member's notification preferences,,
MO-0415,FL-0071,System sends email notifications to members who have email enabled,,
MO-0416,FL-0071,Team members receive email with sprint summary and link,,
MO-0417,FL-0072,System event triggers a need to notify a user,,
MO-0418,FL-0072,"System creates a notification record with user ID, message, and link",,
MO-0419,FL-0072,System stores the notification in the database,,
